{
  "version": "1.0",
  "document": {
    "title": "典型表格规划测试",
    "projectName": "中化施工总承包项目",
    "bidSection": "技术方案"
  },
  "strategy": {
    "summary": "将资源配置类内容优先表格化，避免与部署图重复。",
    "tableDensity": "medium",
    "avoidDuplicatingIllustrations": true
  },
  "tables": [
    {
      "id": "TB-001",
      "section": "CH-02",
      "title": "表2-1 施工现场临时设施配置表",
      "purpose": "结构化说明办公区、生活区、材料堆场和施工区的配置要求。",
      "reason": "配置清单类内容适合表格表达，不需要绘制成图。",
      "placement": "section_start",
      "columns": ["设施类别", "配置内容", "管理要求", "对应要求"],
      "rows": [
        ["办公区", "项目经理部、会议室、资料室", "统一标识、专人管理", "现场管理要求"],
        ["材料堆场", "钢筋、模板、周转材料分区堆放", "分类标识、防雨防潮", "文明施工要求"]
      ],
      "sourceRefs": ["CH-02", "RQ-TECH-003"],
      "notes": ["表格内容应与施工总平面图保持一致。"]
    }
  ]
}
